{
  "experiment_name": "Yuliya-fullft-ckpt44-singlepass",
  "run_id": "2026-05-09_07-17-48",
  "image_pairs": [
    {
      "scene_id": "011",
      "text_description": "Image A: Accurate target exposure, wide dynamic range, nice colors\n\nImage B: Accurate target exposure, wide dynamic range"
    },
    {
      "scene_id": "012",
      "text_description": "Image A: Accurate target exposure and wide dynamic range\n\nImage B: Accurate target exposure, wide dynamic range, nice colors"
    },
    {
      "scene_id": "023",
      "text_description": "Image A: Accurate target exposure and pleasant skin tones\n\nImage B: Accurate target exposure and pleasant skin tones"
    },
    {
      "scene_id": "066",
      "text_description": "Image A: Good exposure, slight highlight clipping\n\nImage B: Accurate target exposure, slight highlight clipping"
    },
    {
      "scene_id": "068",
      "text_description": "Image A: Accurate target exposure and nice colors\n\nImage B: Good exposure, slight highlight clipping"
    },
    {
      "scene_id": "088",
      "text_description": "Image A: Accurate target exposure and nice colors\n\nImage B: Accurate target exposure and nice colors"
    },
    {
      "scene_id": "114",
      "text_description": "Image A: Accurate target exposure and nice colors\n\nImage B: Accurate target exposure and pleasant skin tones"
    },
    {
      "scene_id": "191",
      "text_description": "Image A: Motion blur\n\nImage B: Motion blur"
    },
    {
      "scene_id": "002",
      "text_description": "Image A: Accurate target exposure, slight highlight clipping\n\nImage B: Accurate target exposure and nice colors"
    },
    {
      "scene_id": "003",
      "text_description": "Image A: Accurate target exposure and pleasant skin tones\n\nImage B: Good exposure, slight highlight clipping"
    },
    {
      "scene_id": "006",
      "text_description": "Image A: Accurate target exposure and wide dynamic range\n\nImage B: Accurate target exposure, wide dynamic range, good detail"
    },
    {
      "scene_id": "009",
      "text_description": "Image A: Accurate target exposure, wide dynamic range, nice colors\n\nImage B: Accurate exposure, wide dynamic range"
    },
    {
      "scene_id": "016",
      "text_description": "Image A: Accurate target exposure, wide dynamic range, pleasant color rendering\n\nImage B: Accurate target exposure, wide dynamic range, pleasant color rendering"
    },
    {
      "scene_id": "031",
      "text_description": "Image A: Good detail\n\nImage B: Good detail"
    },
    {
      "scene_id": "034",
      "text_description": "Image A: Accurate target exposure and nice colors\n\nImage B: Accurate target exposure, wide dynamic range"
    },
    {
      "scene_id": "047",
      "text_description": "Image A: Accurate target exposure and pleasant skin tones\n\nImage B: Accurate target exposure and pleasant skin tones"
    },
    {
      "scene_id": "056",
      "text_description": "Image A: Accurate target exposure and wide dynamic range\n\nImage B: Accurate target exposure, wide dynamic range"
    },
    {
      "scene_id": "061",
      "text_description": "Image A: Accurate target exposure, wide dynamic range, good detail\n\nImage B: Accurate target exposure and nice colors"
    },
    {
      "scene_id": "065",
      "text_description": "Image A: Good exposure\n\nImage B: Accurate target exposure, wide dynamic range"
    },
    {
      "scene_id": "082",
      "text_description": "Image A: Accurate exposure, nice colors\n\nImage B: Accurate exposure, nice colors"
    },
    {
      "scene_id": "084",
      "text_description": "Image A: Good exposure, slight highlight clipping\n\nImage B: Accurate exposure, slight highlight clipping"
    },
    {
      "scene_id": "086",
      "text_description": "Image A: Accurate target exposure and pleasant skin tones\n\nImage B: Good exposure and nice colors"
    },
    {
      "scene_id": "091",
      "text_description": "Image A: Accurate target exposure and nice colors\n\nImage B: Good exposure, slight highlight clipping"
    },
    {
      "scene_id": "098",
      "text_description": "Image A: Good detail\n\nImage B: Good detail"
    },
    {
      "scene_id": "102",
      "text_description": "Image A: Motion blur\n\nImage B: Motion blur"
    },
    {
      "scene_id": "111",
      "text_description": "Image A: Accurate exposure and nice colors\n\nImage B: Accurate exposure, nice colors"
    },
    {
      "scene_id": "126",
      "text_description": "Image A: Accurate exposure, slight loss of detail\n\nImage B: Good exposure, slight highlight clipping"
    },
    {
      "scene_id": "142",
      "text_description": "Image A: Accurate target exposure and wide dynamic range\n\nImage B: Accurate target exposure and wide dynamic range"
    }
  ],
  "metadata": {
    "prompt": "Provide a detailed evaluation of the image quality.",
    "source": "logs/tcl_eval/single_natural_fullft-ckpt44.json",
    "method": "single-image inference per camera, concatenated for collator"
  }
}