{
  "experiment_name": "Yuliya-merger-ckpt22-singlepass",
  "run_id": "2026-05-09_07-19-30",
  "image_pairs": [
    {
      "scene_id": "011",
      "text_description": "Image A: Good exposure, nice colors\n\nImage B: Good detail in good exposure"
    },
    {
      "scene_id": "012",
      "text_description": "Image A: Good detail and color rendering\n\nImage B: Good detail and color rendering"
    },
    {
      "scene_id": "023",
      "text_description": "Image A: Good exposure and color rendering\n\nImage B: Good exposure and color rendering"
    },
    {
      "scene_id": "066",
      "text_description": "Image A: Good exposure and color rendering\n\nImage B: Good exposure rendering, nice colors"
    },
    {
      "scene_id": "068",
      "text_description": "Image A: Good exposure and color rendering\n\nImage B: Good exposure and color rendering"
    },
    {
      "scene_id": "088",
      "text_description": "Image A: Good detail and color rendering\n\nImage B: Good detail and color rendering"
    },
    {
      "scene_id": "114",
      "text_description": "Image A: Good exposure and color rendering\n\nImage B: Good exposure and color rendering"
    },
    {
      "scene_id": "191",
      "text_description": "Image A: Motion blur\n\nImage B: Good exposure and color rendering"
    },
    {
      "scene_id": "002",
      "text_description": "Image A: Good detail rendering, slight loss of detail in the door\n\nImage B: Good detail rendering, slight loss of detail in the ceiling"
    },
    {
      "scene_id": "003",
      "text_description": "Image A: Good exposure and color rendering\n\nImage B: Good exposure and color rendering"
    },
    {
      "scene_id": "006",
      "text_description": "Image A: Good exposure and color rendering\n\nImage B: Good color rendering, slight loss of detail"
    },
    {
      "scene_id": "009",
      "text_description": "Image A: Good detail and color rendering\n\nImage B: Good detail and color rendering"
    },
    {
      "scene_id": "016",
      "text_description": "Image A: Good color rendering, slight loss of detail\n\nImage B: Good color rendering, good detail"
    },
    {
      "scene_id": "031",
      "text_description": "Image A: Good detail and color rendering\n\nImage B: Good detail and color rendering"
    },
    {
      "scene_id": "034",
      "text_description": "Image A: Good detail and color rendering\n\nImage B: Good detail and color rendering"
    },
    {
      "scene_id": "047",
      "text_description": "Image A: Good color rendering, good detail in the the sky\n\nImage B: Good exposure, slight loss of detail"
    },
    {
      "scene_id": "056",
      "text_description": "Image A: Good detail and color rendering\n\nImage B: Good detail and color rendering"
    },
    {
      "scene_id": "061",
      "text_description": "Image A: Good detail and color rendering\n\nImage B: Good detail and color rendering"
    },
    {
      "scene_id": "065",
      "text_description": "Image A: Good exposure and color rendering\n\nImage B: Good exposure and color rendering"
    },
    {
      "scene_id": "082",
      "text_description": "Image A: Good exposure and color rendering\n\nImage B: Good exposure and color rendering"
    },
    {
      "scene_id": "084",
      "text_description": "Image A: Underexposure\n\nImage B: Good exposure, nice colors"
    },
    {
      "scene_id": "086",
      "text_description": "Image A: Good exposure and color rendering\n\nImage B: Good exposure and color rendering"
    },
    {
      "scene_id": "091",
      "text_description": "Image A: Good exposure and color rendering\n\nImage B: Good exposure and detail rendering"
    },
    {
      "scene_id": "098",
      "text_description": "Image A: Good detail\n\nImage B: Good detail and color rendering"
    },
    {
      "scene_id": "102",
      "text_description": "Image A: Motion blur\n\nImage B: Motion blur"
    },
    {
      "scene_id": "111",
      "text_description": "Image A: Good detail and color rendering\n\nImage B: Good exposure and color rendering"
    },
    {
      "scene_id": "126",
      "text_description": "Image A: Good exposure, nice colors\n\nImage B: Good exposure and color rendering"
    },
    {
      "scene_id": "142",
      "text_description": "Image A: Good detail and color rendering\n\nImage B: Good detail rendering, good color rendering"
    }
  ],
  "metadata": {
    "prompt": "Provide a detailed evaluation of the image quality.",
    "source": "logs/tcl_eval/single_natural_merger-ckpt22.json",
    "method": "single-image inference per camera, concatenated for collator"
  }
}